{
  "limitations" : [
    "Deterministic audit fixture; not a historical observation."
  ],
  "observed_at" : "2026-09-12T00:00:00.000Z",
  "schema" : "storage-snapshot-v1",
  "scope" : "whole-volume",
  "snapshot_id" : "gate-190-fixture",
  "volumes" : [
    {
      "available_bytes" : 350000000,
      "is_internal" : true,
      "is_read_only" : false,
      "mount_path" : "/fixture-data",
      "total_bytes" : 1000000000,
      "used_bytes" : 650000000
    }
  ]
}